[
  {
    "id": "v-spaced-repetition",
    "word": "spaced repetition",
    "phonetic": "/speɪst ˌrepəˈtɪʃn/",
    "pos": "n.",
    "meaning": "间隔重复（记忆法）",
    "example": "Anki uses spaced repetition to fight forgetting.",
    "level": "B2",
    "skill": "vocab",
    "tags": [
      "记忆法",
      "高频"
    ]
  },
  {
    "id": "v-comprehensible-input",
    "word": "comprehensible input",
    "phonetic": "/ˌkɒmprɪˈhensəbl ˈɪnpʊt/",
    "pos": "n.",
    "meaning": "可理解输入（i+1 输入假说）",
    "example": "Listen to lots of comprehensible input before speaking.",
    "level": "C1",
    "skill": "vocab",
    "tags": [
      "方法论",
      "听力"
    ]
  },
  {
    "id": "v-shadowing",
    "word": "shadowing",
    "phonetic": "/ˈʃædəʊɪŋ/",
    "pos": "n.",
    "meaning": "影子跟读（同步复述训练）",
    "example": "Shadowing news audio improves fluency fast.",
    "level": "B2",
    "skill": "vocab",
    "tags": [
      "口语",
      "训练法"
    ]
  },
  {
    "id": "v-fluency",
    "word": "fluency",
    "phonetic": "/ˈfluːənsi/",
    "pos": "n.",
    "meaning": "流利度",
    "example": "Daily reading builds both accuracy and fluency.",
    "level": "B1",
    "skill": "vocab",
    "tags": [
      "口语",
      "核心"
    ]
  },
  {
    "id": "v-mastery",
    "word": "mastery",
    "phonetic": "/ˈmɑːstəri/",
    "pos": "n.",
    "meaning": "精通；掌握",
    "example": "Mastery comes from repeated, varied practice.",
    "level": "B2",
    "skill": "vocab",
    "tags": [
      "学习",
      "核心"
    ]
  },
  {
    "id": "v-consistency",
    "word": "consistency",
    "phonetic": "/kənˈsɪstənsi/",
    "pos": "n.",
    "meaning": "一致性；持续性",
    "example": "Consistency beats intensity for language learning.",
    "level": "B1",
    "skill": "vocab",
    "tags": [
      "习惯",
      "核心"
    ]
  },
  {
    "id": "v-retention",
    "word": "retention",
    "phonetic": "/rɪˈtenʃn/",
    "pos": "n.",
    "meaning": "保持；记忆保持率",
    "example": "Active recall improves long-term retention.",
    "level": "C1",
    "skill": "vocab",
    "tags": [
      "记忆法",
      "高频"
    ]
  },
  {
    "id": "v-deliberate-practice",
    "word": "deliberate practice",
    "phonetic": "/dɪˈlɪbərət ˈpræktɪs/",
    "pos": "n.",
    "meaning": "刻意练习",
    "example": "Deliberate practice targets your weakest skill.",
    "level": "C1",
    "skill": "vocab",
    "tags": [
      "方法论",
      "高效"
    ]
  },
  {
    "id": "v-cohesion",
    "word": "cohesion",
    "phonetic": "/kəʊˈhiːʒn/",
    "pos": "n.",
    "meaning": "（语篇）衔接",
    "example": "Use linking words for better cohesion in writing.",
    "level": "B2",
    "skill": "vocab",
    "tags": [
      "写作",
      "高频"
    ]
  },
  {
    "id": "v-pragmatic",
    "word": "pragmatic",
    "phonetic": "/præɡˈmætɪk/",
    "pos": "adj.",
    "meaning": "务实的；语用（学）的",
    "example": "A pragmatic study plan fits your real schedule.",
    "level": "C1",
    "skill": "vocab",
    "tags": [
      "方法论",
      "高效"
    ]
  },
  {
    "id": "v-cadence",
    "word": "cadence",
    "phonetic": "/ˈkeɪdns/",
    "pos": "n.",
    "meaning": "节奏；语调起伏",
    "example": "Match the speaker's cadence when shadowing.",
    "level": "B2",
    "skill": "vocab",
    "tags": [
      "口语",
      "发音"
    ]
  },
  {
    "id": "v-corpus",
    "word": "corpus",
    "phonetic": "/ˈkɔːpərəs/",
    "pos": "n.",
    "meaning": "语料库",
    "example": "A frequency corpus helps you pick high-value words.",
    "level": "C1",
    "skill": "vocab",
    "tags": [
      "词汇",
      "工具"
    ]
  },
  {
    "id": "v-curriculum",
    "word": "curriculum",
    "phonetic": "/kəˈrɪkjələm/",
    "pos": "n.",
    "meaning": "课程（总教学计划）",
    "example": "The school revised its curriculum to include AI literacy.",
    "level": "B2",
    "skill": "vocab",
    "tags": [
      "学术",
      "学校"
    ]
  },
  {
    "id": "v-syllabus",
    "word": "syllabus",
    "phonetic": "/ˈsɪləbəs/",
    "pos": "n.",
    "meaning": "教学大纲",
    "example": "Read the syllabus before the first seminar.",
    "level": "B2",
    "skill": "vocab",
    "tags": [
      "学术",
      "学校"
    ]
  },
  {
    "id": "v-seminar",
    "word": "seminar",
    "phonetic": "/ˈsemɪnɑː(r)/",
    "pos": "n.",
    "meaning": "研讨课（小班讨论）",
    "example": "We debated the topic in a small-group seminar.",
    "level": "B2",
    "skill": "vocab",
    "tags": [
      "学术",
      "口语"
    ]
  },
  {
    "id": "v-tutorial",
    "word": "tutorial",
    "phonetic": "/tjuˈtɔːriəl/",
    "pos": "n.",
    "meaning": "辅导课 / 导师制",
    "example": "My tutor answered questions in the weekly tutorial.",
    "level": "B1",
    "skill": "vocab",
    "tags": [
      "学术",
      "学校"
    ]
  },
  {
    "id": "v-enroll",
    "word": "enroll",
    "phonetic": "/ɪnˈrəʊl/",
    "pos": "v.",
    "meaning": "注册 / 入学",
    "example": "She enrolled in the online course last month.",
    "level": "B1",
    "skill": "vocab",
    "tags": [
      "学校",
      "高频"
    ]
  },
  {
    "id": "v-assignment",
    "word": "assignment",
    "phonetic": "/əˈsaɪnmənt/",
    "pos": "n.",
    "meaning": "作业 / 任务",
    "example": "Submit your assignment before the deadline.",
    "level": "A2",
    "skill": "vocab",
    "tags": [
      "学校",
      "高频"
    ]
  },
  {
    "id": "v-deadline",
    "word": "deadline",
    "phonetic": "/ˈdedlaɪn/",
    "pos": "n.",
    "meaning": "截止日期",
    "example": "Plan ahead so deadlines don't pile up.",
    "level": "B1",
    "skill": "vocab",
    "tags": [
      "学校",
      "时间"
    ]
  },
  {
    "id": "v-plagiarism",
    "word": "plagiarism",
    "phonetic": "/ˈpleɪdʒərɪzəm/",
    "pos": "n.",
    "meaning": "抄袭",
    "example": "Always cite sources to avoid plagiarism.",
    "level": "C1",
    "skill": "vocab",
    "tags": [
      "学术",
      "诚信"
    ]
  },
  {
    "id": "v-citation",
    "word": "citation",
    "phonetic": "/saɪˈteɪʃn/",
    "pos": "n.",
    "meaning": "引用（文献出处）",
    "example": "Use a standard format for each citation.",
    "level": "C1",
    "skill": "vocab",
    "tags": [
      "学术",
      "写作"
    ]
  },
  {
    "id": "v-thesis",
    "word": "thesis",
    "phonetic": "/ˈθiːsɪs/",
    "pos": "n.",
    "meaning": "论文 / 学位论文",
    "example": "His thesis explored bilingual memory.",
    "level": "C1",
    "skill": "vocab",
    "tags": [
      "学术",
      "写作"
    ]
  },
  {
    "id": "v-scholarship",
    "word": "scholarship",
    "phonetic": "/ˈskɒləʃɪp/",
    "pos": "n.",
    "meaning": "奖学金",
    "example": "She won a scholarship for academic excellence.",
    "level": "B2",
    "skill": "vocab",
    "tags": [
      "学校",
      "机会"
    ]
  },
  {
    "id": "v-extracurricular",
    "word": "extracurricular",
    "phonetic": "/ˌekstrəkəˈrɪkjələ(r)/",
    "pos": "adj.",
    "meaning": "课外的",
    "example": "Extracurricular clubs build soft skills.",
    "level": "B2",
    "skill": "vocab",
    "tags": [
      "学校",
      "综合"
    ]
  },
  {
    "id": "v-water",
    "word": "water",
    "phonetic": "/ˈwɔːtə(r)/",
    "pos": "n.",
    "meaning": "水",
    "example": "I drink water every morning.",
    "level": "A1",
    "skill": "vocab",
    "tags": [
      "日常",
      "高频"
    ]
  },
  {
    "id": "v-happy",
    "word": "happy",
    "phonetic": "/ˈhæpi/",
    "pos": "adj.",
    "meaning": "高兴的；快乐的",
    "example": "She feels happy today.",
    "level": "A1",
    "skill": "vocab",
    "tags": [
      "日常",
      "情感"
    ]
  },
  {
    "id": "v-eat",
    "word": "eat",
    "phonetic": "/iːt/",
    "pos": "v.",
    "meaning": "吃",
    "example": "We eat dinner at seven.",
    "level": "A1",
    "skill": "vocab",
    "tags": [
      "日常",
      "高频"
    ]
  },
  {
    "id": "v-friend",
    "word": "friend",
    "phonetic": "/frend/",
    "pos": "n.",
    "meaning": "朋友",
    "example": "My friend lives next door.",
    "level": "A1",
    "skill": "vocab",
    "tags": [
      "日常",
      "高频"
    ]
  },
  {
    "id": "v-big",
    "word": "big",
    "phonetic": "/bɪɡ/",
    "pos": "adj.",
    "meaning": "大的",
    "example": "They live in a big house.",
    "level": "A1",
    "skill": "vocab",
    "tags": [
      "日常",
      "描述"
    ]
  },
  {
    "id": "v-book",
    "word": "book",
    "phonetic": "/bʊk/",
    "pos": "n.",
    "meaning": "书",
    "example": "I read a book before bed.",
    "level": "A1",
    "skill": "vocab",
    "tags": [
      "日常",
      "学校"
    ]
  },
  {
    "id": "v-school",
    "word": "school",
    "phonetic": "/skuːl/",
    "pos": "n.",
    "meaning": "学校",
    "example": "The children walk to school.",
    "level": "A1",
    "skill": "vocab",
    "tags": [
      "学校",
      "高频"
    ]
  },
  {
    "id": "v-day",
    "word": "day",
    "phonetic": "/deɪ/",
    "pos": "n.",
    "meaning": "天；白天",
    "example": "Have a nice day!",
    "level": "A1",
    "skill": "vocab",
    "tags": [
      "日常",
      "时间"
    ]
  },
  {
    "id": "v-run",
    "word": "run",
    "phonetic": "/rʌn/",
    "pos": "v.",
    "meaning": "跑",
    "example": "I run in the park each morning.",
    "level": "A1",
    "skill": "vocab",
    "tags": [
      "日常",
      "运动"
    ]
  },
  {
    "id": "v-house",
    "word": "house",
    "phonetic": "/haʊs/",
    "pos": "n.",
    "meaning": "房子",
    "example": "Their house has a red door.",
    "level": "A1",
    "skill": "vocab",
    "tags": [
      "日常",
      "高频"
    ]
  },
  {
    "id": "v-teacher",
    "word": "teacher",
    "phonetic": "/ˈtiːtʃə(r)/",
    "pos": "n.",
    "meaning": "老师",
    "example": "Our teacher is very kind.",
    "level": "A1",
    "skill": "vocab",
    "tags": [
      "学校",
      "高频"
    ]
  },
  {
    "id": "v-family",
    "word": "family",
    "phonetic": "/ˈfæməli/",
    "pos": "n.",
    "meaning": "家庭",
    "example": "My family eats together on Sundays.",
    "level": "A1",
    "skill": "vocab",
    "tags": [
      "日常",
      "高频"
    ]
  },
  {
    "id": "v-morning",
    "word": "morning",
    "phonetic": "/ˈmɔːnɪŋ/",
    "pos": "n.",
    "meaning": "早晨",
    "example": "I study English every morning.",
    "level": "A1",
    "skill": "vocab",